{
  "config": {
    "provider": "ollama",
    "model": "llama3.1:latest",
    "base_url": "http://ollama.local",
    "max_tokens": 10000,
    "iterations": 102,
    "stream": false,
    "parallel_size": 1,
    "prompt_file": "prompt.txt",
    "raw_responses_dir": "./responses",
    "output": "results-102-155W-n1-20260807_220929_002126.json"
  },
  "model": {
    "name": "llama3.1:latest",
    "family": "llama",
    "path": "llama3.1:latest",
    "format": "gguf",
    "parameter_size": "8.0B",
    "quantization_level": "Q4_K_M"
  },
  "summary": {
    "start_wall_time_ns": 1786140569002126743,
    "start_monotonic_time_ns": 1786140569002126743,
    "iterations": 102,
    "tdp": 155,
    "gpus": [
      {
        "vendor_id": "1002",
        "product_id": "73BF",
        "subsystem_vendor_id": "1EAE",
        "subsystem_product_id": "6705"
      }
    ],
    "avg_prompt_tps": 5454.7750513005785,
    "p50_prompt_tps": 5343.526364000723,
    "avg_response_tps": 61.156166518635516,
    "p50_response_tps": 61.1549181669233
  },
  "metrics": [
    {
      "request_start_time_ns": 1786140569002126743,
      "request_end_time_ns": 1786140600458070818,
      "prompt_length": 151,
      "prompt_processing_time_ns": 57403000,
      "response_length": 1874,
      "response_generating_time_ns": 30585330000,
      "load_model_time_ns": 735894774,
      "provider_total_time_ns": 31389281276
    },
    {
      "request_start_time_ns": 1786140600458810953,
      "request_end_time_ns": 1786140631694322525,
      "prompt_length": 151,
      "prompt_processing_time_ns": 28112000,
      "response_length": 1874,
      "response_generating_time_ns": 30441179000,
      "load_model_time_ns": 638841866,
      "provider_total_time_ns": 31117377210
    },
    {
      "request_start_time_ns": 1786140631696621014,
      "request_end_time_ns": 1786140662923863993,
      "prompt_length": 151,
      "prompt_processing_time_ns": 28191000,
      "response_length": 1874,
      "response_generating_time_ns": 30446139000,
      "load_model_time_ns": 656547672,
      "provider_total_time_ns": 31142635796
    },
    {
      "request_start_time_ns": 1786140662926675889,
      "request_end_time_ns": 1786140694329382951,
      "prompt_length": 151,
      "prompt_processing_time_ns": 23937000,
      "response_length": 1874,
      "response_generating_time_ns": 30611565000,
      "load_model_time_ns": 721323950,
      "provider_total_time_ns": 31365730168
    },
    {
      "request_start_time_ns": 1786140694347562157,
      "request_end_time_ns": 1786140725830694913,
      "prompt_length": 151,
      "prompt_processing_time_ns": 28826000,
      "response_length": 1874,
      "response_generating_time_ns": 30642717000,
      "load_model_time_ns": 686113379,
      "provider_total_time_ns": 31367450811
    },
    {
      "request_start_time_ns": 1786140725833244683,
      "request_end_time_ns": 1786140757234330262,
      "prompt_length": 151,
      "prompt_processing_time_ns": 28556000,
      "response_length": 1874,
      "response_generating_time_ns": 30638069000,
      "load_model_time_ns": 681614016,
      "provider_total_time_ns": 31358166114
    },
    {
      "request_start_time_ns": 1786140757237206801,
      "request_end_time_ns": 1786140788708804962,
      "prompt_length": 151,
      "prompt_processing_time_ns": 29349000,
      "response_length": 1874,
      "response_generating_time_ns": 30715404000,
      "load_model_time_ns": 689549224,
      "provider_total_time_ns": 31445335311
    },
    {
      "request_start_time_ns": 1786140788712534439,
      "request_end_time_ns": 1786140820143499180,
      "prompt_length": 151,
      "prompt_processing_time_ns": 28908000,
      "response_length": 1874,
      "response_generating_time_ns": 30670570000,
      "load_model_time_ns": 684780697,
      "provider_total_time_ns": 31394889060
    },
    {
      "request_start_time_ns": 1786140820153898640,
      "request_end_time_ns": 1786140851648520629,
      "prompt_length": 151,
      "prompt_processing_time_ns": 24732000,
      "response_length": 1874,
      "response_generating_time_ns": 30702078000,
      "load_model_time_ns": 642758502,
      "provider_total_time_ns": 31377837798
    },
    {
      "request_start_time_ns": 1786140851651075904,
      "request_end_time_ns": 1786140882926214183,
      "prompt_length": 151,
      "prompt_processing_time_ns": 26580000,
      "response_length": 1874,
      "response_generating_time_ns": 30626492000,
      "load_model_time_ns": 564037522,
      "provider_total_time_ns": 31227755517
    },
    {
      "request_start_time_ns": 1786140882933715450,
      "request_end_time_ns": 1786140914326293060,
      "prompt_length": 151,
      "prompt_processing_time_ns": 28651000,
      "response_length": 1874,
      "response_generating_time_ns": 30690432000,
      "load_model_time_ns": 615184207,
      "provider_total_time_ns": 31343384671
    },
    {
      "request_start_time_ns": 1786140914335787539,
      "request_end_time_ns": 1786140945744852923,
      "prompt_length": 151,
      "prompt_processing_time_ns": 28522000,
      "response_length": 1874,
      "response_generating_time_ns": 30690054000,
      "load_model_time_ns": 656053704,
      "provider_total_time_ns": 31384351958
    },
    {
      "request_start_time_ns": 1786140945748127132,
      "request_end_time_ns": 1786140977088302680,
      "prompt_length": 151,
      "prompt_processing_time_ns": 27792000,
      "response_length": 1874,
      "response_generating_time_ns": 30678108000,
      "load_model_time_ns": 583607028,
      "provider_total_time_ns": 31298730905
    },
    {
      "request_start_time_ns": 1786140977090031760,
      "request_end_time_ns": 1786141008633080295,
      "prompt_length": 151,
      "prompt_processing_time_ns": 28840000,
      "response_length": 1874,
      "response_generating_time_ns": 30725019000,
      "load_model_time_ns": 637145148,
      "provider_total_time_ns": 31402157617
    },
    {
      "request_start_time_ns": 1786141008635436398,
      "request_end_time_ns": 1786141040134358139,
      "prompt_length": 151,
      "prompt_processing_time_ns": 29107000,
      "response_length": 1874,
      "response_generating_time_ns": 30704438000,
      "load_model_time_ns": 690078134,
      "provider_total_time_ns": 31434456487
    },
    {
      "request_start_time_ns": 1786141040137099327,
      "request_end_time_ns": 1786141071624444208,
      "prompt_length": 151,
      "prompt_processing_time_ns": 29122000,
      "response_length": 1874,
      "response_generating_time_ns": 30721528000,
      "load_model_time_ns": 696730336,
      "provider_total_time_ns": 31457377117
    },
    {
      "request_start_time_ns": 1786141071633439556,
      "request_end_time_ns": 1786141103012972609,
      "prompt_length": 151,
      "prompt_processing_time_ns": 28176000,
      "response_length": 1874,
      "response_generating_time_ns": 30745859000,
      "load_model_time_ns": 558106687,
      "provider_total_time_ns": 31343068038
    },
    {
      "request_start_time_ns": 1786141103015348814,
      "request_end_time_ns": 1786141134381680206,
      "prompt_length": 151,
      "prompt_processing_time_ns": 26820000,
      "response_length": 1874,
      "response_generating_time_ns": 30666956000,
      "load_model_time_ns": 628800386,
      "provider_total_time_ns": 31332905193
    },
    {
      "request_start_time_ns": 1786141134383430451,
      "request_end_time_ns": 1786141165610071299,
      "prompt_length": 151,
      "prompt_processing_time_ns": 24906000,
      "response_length": 1874,
      "response_generating_time_ns": 30672743000,
      "load_model_time_ns": 488457141,
      "provider_total_time_ns": 31194737348
    },
    {
      "request_start_time_ns": 1786141165612744569,
      "request_end_time_ns": 1786141197034958033,
      "prompt_length": 151,
      "prompt_processing_time_ns": 28638000,
      "response_length": 1874,
      "response_generating_time_ns": 30675474000,
      "load_model_time_ns": 679641159,
      "provider_total_time_ns": 31392809275
    },
    {
      "request_start_time_ns": 1786141197037979036,
      "request_end_time_ns": 1786141228459843075,
      "prompt_length": 151,
      "prompt_processing_time_ns": 27473000,
      "response_length": 1874,
      "response_generating_time_ns": 30724341000,
      "load_model_time_ns": 626802988,
      "provider_total_time_ns": 31388041998
    },
    {
      "request_start_time_ns": 1786141228460708115,
      "request_end_time_ns": 1786141259822299220,
      "prompt_length": 151,
      "prompt_processing_time_ns": 27532000,
      "response_length": 1874,
      "response_generating_time_ns": 30652246000,
      "load_model_time_ns": 636974316,
      "provider_total_time_ns": 31327256288
    },
    {
      "request_start_time_ns": 1786141259824710564,
      "request_end_time_ns": 1786141291256521749,
      "prompt_length": 151,
      "prompt_processing_time_ns": 28543000,
      "response_length": 1874,
      "response_generating_time_ns": 30682863000,
      "load_model_time_ns": 649264850,
      "provider_total_time_ns": 31370667173
    },
    {
      "request_start_time_ns": 1786141291259404941,
      "request_end_time_ns": 1786141322722032203,
      "prompt_length": 151,
      "prompt_processing_time_ns": 29065000,
      "response_length": 1874,
      "response_generating_time_ns": 30677309000,
      "load_model_time_ns": 711955055,
      "provider_total_time_ns": 31427877039
    },
    {
      "request_start_time_ns": 1786141322731998070,
      "request_end_time_ns": 1786141354098314120,
      "prompt_length": 151,
      "prompt_processing_time_ns": 27903000,
      "response_length": 1874,
      "response_generating_time_ns": 30686511000,
      "load_model_time_ns": 608417002,
      "provider_total_time_ns": 31333045528
    },
    {
      "request_start_time_ns": 1786141354122941353,
      "request_end_time_ns": 1786141385554176700,
      "prompt_length": 151,